{
  "_links": {
    "self": {
      "href": "http://api.service.hmrc.gov.uk/my-organisation/clients?clientOrganisation=egg&page=1&pageSize=15",
      "template": false
    },
    "first": {
      "href": "http://api.service.hmrc.gov.uk/my-organisation/clients?clientOrganisation=egg&page=1&pageSize=15",
      "template": false
    },
    "last": {
      "href": "http://api.service.hmrc.gov.uk/my-organisation/clients?clientOrganisation=egg&page=1&pageSize=15",
      "template": false
    }
  },
  "page": 1,
  "pageSize": 15,
  "total": 2,
  "clients": [
    {
      "_links": {
        "propertyLinks": {
          "href": "http://api.service.hmrc.gov.uk/my-organisation/clients/all/property-links?clientOrganisation=Client%20Organisation%201&page=1&pageSize=15",
          "template": false
        }
      },
      "organisationId": 606,
      "organisationName": "Client Organisation 1",
      "appointedDate": "2020-03-24",
      "propertyCount": 2
    },
    {
      "_links": {
        "propertyLinks": {
          "href": "http://api.service.hmrc.gov.uk/my-organisation/clients/all/property-links?clientOrganisation=Another%20client&page=1&pageSize=15",
          "template": false
        }
      },
      "organisationId": 164,
      "organisationName": "Another client",
      "appointedDate": "2020-03-24",
      "propertyCount": 17
    }
  ]
}